{
  "schemaVersion": 1,
  "preparedOn": "2026-09-23",
  "moneyBasis": "Sep 2026 pounds unless a unit says nominal",
  "entries": {
    "payslip.asOf": {
      "value": "2026-09",
      "unit": "payslip month",
      "status": "FACT",
      "source": "Abby payslip Sep 2026 (tax month 06)",
      "asOf": "2026-09-30",
      "reviewBy": "2026-10-15",
      "cadence": "monthly",
      "triggers": [
        "payslip"
      ],
      "history": [
        {
          "value": "2026-08",
          "asOf": "2026-08-31",
          "supersededOn": "2026-09-30"
        }
      ]
    },
    "payslip.basicAnnual": {
      "value": 73837.8,
      "unit": "GBP/yr nominal",
      "status": "FACT",
      "source": "Abby payslip Aug 2026: basic £6,153.15/mo x 12",
      "asOf": "2026-08-31",
      "reviewBy": "2026-10-15",
      "cadence": "monthly",
      "triggers": [
        "payslip",
        "job-change"
      ],
      "history": [
        {
          "value": 69900,
          "asOf": "2026-04-30",
          "supersededOn": "2026-09-20",
          "why": "pay rise landed since April (+5.6%); found by the 20 Sep audit"
        }
      ]
    },
    "payslip.carAllowance": {
      "value": 6500,
      "unit": "GBP/yr nominal",
      "status": "FACT",
      "source": "Abby payslip: £541.67/mo, not pensionable, assumed flat",
      "asOf": "2026-08-31",
      "reviewBy": "2027-04-06",
      "cadence": "tax-year",
      "triggers": [
        "payslip",
        "job-change"
      ]
    },
    "payslip.medicalBik": {
      "value": 1330,
      "unit": "GBP/yr nominal",
      "status": "FACT",
      "source": "Abby payslip: £110.83/mo payrolled benefit; note tax code 1117L also codes out £1,400 (double-taxed ~£560/yr, to square via self-assessment)",
      "asOf": "2026-08-31",
      "reviewBy": "2027-04-06",
      "cadence": "tax-year",
      "triggers": [
        "payslip"
      ]
    },
    "payslip.bonusRate": {
      "value": 0.05,
      "unit": "fraction of basic",
      "status": "GUESS",
      "source": "5% assumed; bonus confirmed sacrificeable (Chris, 20 Sep 2026). True up in January when known",
      "asOf": "2026-07-30",
      "reviewBy": "2027-01-31",
      "cadence": "annual",
      "triggers": [
        "bonus-confirmed"
      ]
    },
    "payslip.existingEeRate": {
      "value": 0.045,
      "unit": "fraction of basic",
      "status": "FACT",
      "source": "Abby payslip: 4.5% employee salary sacrifice on basic (shows inside Pension ER)",
      "asOf": "2026-08-31",
      "reviewBy": "2027-04-06",
      "cadence": "tax-year",
      "triggers": [
        "payslip"
      ]
    },
    "payslip.employerRate": {
      "value": 0.12,
      "unit": "fraction of basic",
      "status": "FACT",
      "source": "Abby payslip Sep 2026: Pension ER % 12.00 (was 11% on the Apr/Aug payslips); Pension ER this month 3,907.25 = 12% of basic 738.38 + the salary-sacrificed 3,168.87",
      "asOf": "2026-09-30",
      "reviewBy": "2027-04-06",
      "cadence": "tax-year",
      "triggers": [
        "payslip",
        "job-change"
      ],
      "history": [
        {
          "value": 0.11,
          "asOf": "2026-08-31",
          "supersededOn": "2026-09-30"
        }
      ]
    },
    "payslip.payGrowth": {
      "value": 0.02,
      "unit": "per year, basic only",
      "status": "GUESS",
      "source": "planning assumption (Amendment 1); Apr→Aug 2026 actual was +5.6%",
      "asOf": "2026-07-30",
      "reviewBy": "2027-09-01",
      "cadence": "annual",
      "triggers": [
        "job-change"
      ]
    },
    "tax.personalAllowance": {
      "value": 12570,
      "unit": "GBP nominal",
      "status": "FACT",
      "source": "gov.uk income tax rates 2026/27; frozen to Apr 2031 (Autumn Budget 2025)",
      "asOf": "2026-04-06",
      "reviewBy": "2027-04-06",
      "cadence": "tax-year",
      "triggers": [
        "april",
        "budget"
      ]
    },
    "tax.basicRateBand": {
      "value": 37700,
      "unit": "GBP nominal",
      "status": "FACT",
      "source": "gov.uk 2026/27: 20% band above the allowance; frozen to Apr 2031",
      "asOf": "2026-04-06",
      "reviewBy": "2027-04-06",
      "cadence": "tax-year",
      "triggers": [
        "april",
        "budget"
      ]
    },
    "tax.higherRateFloor": {
      "value": 50270,
      "unit": "GBP nominal",
      "status": "FACT",
      "source": "gov.uk 2026/27: personal allowance + basic-rate band",
      "asOf": "2026-04-06",
      "reviewBy": "2027-04-06",
      "cadence": "tax-year",
      "triggers": [
        "april",
        "budget"
      ]
    },
    "tax.thresholdsFrozenThroughTaxYear": {
      "value": 2030,
      "unit": "tax year (2030 = 2030/31)",
      "status": "FACT",
      "source": "Autumn Budget 2025: personal allowance and higher-rate threshold frozen to April 2031. CPI-indexed afterwards is the model's assumption",
      "asOf": "2025-11-26",
      "reviewBy": "2027-04-06",
      "cadence": "tax-year",
      "triggers": [
        "april",
        "budget"
      ]
    },
    "tax.basicRate": {
      "value": 0.2,
      "status": "FACT",
      "source": "gov.uk 2026/27",
      "asOf": "2026-04-06",
      "reviewBy": "2027-04-06",
      "cadence": "tax-year",
      "triggers": [
        "april",
        "budget"
      ]
    },
    "tax.higherRate": {
      "value": 0.4,
      "status": "FACT",
      "source": "gov.uk 2026/27",
      "asOf": "2026-04-06",
      "reviewBy": "2027-04-06",
      "cadence": "tax-year",
      "triggers": [
        "april",
        "budget"
      ]
    },
    "tax.payeAllowance": {
      "value": 11179,
      "unit": "GBP nominal",
      "status": "CHECK",
      "source": "Abby tax code 1117L (Apr and Aug 2026 payslips both reconcile to it). Should be 1257L less the payrolled medical only once — query with HMRC",
      "asOf": "2026-08-31",
      "reviewBy": "2027-01-31",
      "cadence": "tax-year",
      "triggers": [
        "payslip",
        "april"
      ]
    },
    "tax.niMainRate": {
      "value": 0.08,
      "status": "FACT",
      "source": "gov.uk employee Class 1 2026/27, between primary threshold and UEL",
      "asOf": "2026-04-06",
      "reviewBy": "2027-04-06",
      "cadence": "tax-year",
      "triggers": [
        "april",
        "budget"
      ]
    },
    "tax.niUpperRate": {
      "value": 0.02,
      "status": "FACT",
      "source": "gov.uk employee Class 1 2026/27, above UEL",
      "asOf": "2026-04-06",
      "reviewBy": "2027-04-06",
      "cadence": "tax-year",
      "triggers": [
        "april",
        "budget"
      ]
    },
    "tax.niPrimaryThreshold": {
      "value": 12570,
      "unit": "GBP nominal",
      "status": "FACT",
      "source": "gov.uk 2026/27",
      "asOf": "2026-04-06",
      "reviewBy": "2027-04-06",
      "cadence": "tax-year",
      "triggers": [
        "april",
        "budget"
      ]
    },
    "tax.niUpperEarningsLimit": {
      "value": 50270,
      "unit": "GBP nominal",
      "status": "FACT",
      "source": "gov.uk 2026/27",
      "asOf": "2026-04-06",
      "reviewBy": "2027-04-06",
      "cadence": "tax-year",
      "triggers": [
        "april",
        "budget"
      ]
    },
    "tax.reliefAbove": {
      "value": 0.42,
      "unit": "relief per £1 sacrificed above the higher-rate floor",
      "status": "FACT",
      "source": "40% income tax + 2% employee NI on salary-sacrificed pay above £50,270 (2026/27). BREAKS Apr 2029: salary-sacrifice NIC cap (Autumn Budget 2025) removes the 2% on the excess over £2k/yr → 0.40; the model must branch by tax year from 2029/30",
      "asOf": "2026-04-06",
      "reviewBy": "2029-04-06",
      "cadence": "tax-year",
      "triggers": [
        "april",
        "budget"
      ]
    },
    "tax.salarySacrificeNicCapFromTaxYear": {
      "value": 2029,
      "unit": "tax year starting",
      "status": "FACT",
      "source": "Autumn Budget 26 Nov 2025: from April 2029 pension salary sacrifice above £2,000 a year attracts employee and employer NIC. Verify the final legislation before 2029/30",
      "asOf": "2025-11-26",
      "reviewBy": "2028-12-31",
      "cadence": "event",
      "triggers": [
        "budget",
        "april"
      ]
    },
    "tax.salarySacrificeNicCapThreshold": {
      "value": 2000,
      "unit": "GBP/yr of sacrifice exempt from the cap",
      "status": "FACT",
      "source": "Autumn Budget 26 Nov 2025 announcement; the existing 4.5% payroll sacrifice already exceeds it, so the whole AVC is NI-able from 2029/30",
      "asOf": "2025-11-26",
      "reviewBy": "2028-12-31",
      "cadence": "event",
      "triggers": [
        "budget",
        "april"
      ]
    },
    "tax.reliefBelow": {
      "value": 0.28,
      "unit": "relief per £1 sacrificed below the higher-rate floor",
      "status": "FACT",
      "source": "20% income tax + 8% employee NI (2026/27)",
      "asOf": "2026-04-06",
      "reviewBy": "2027-04-06",
      "cadence": "tax-year",
      "triggers": [
        "april",
        "budget"
      ]
    },
    "hicbc.lowerThreshold": {
      "value": 60000,
      "unit": "GBP nominal adjusted net income",
      "status": "FACT",
      "source": "gov.uk High Income Child Benefit Charge from Apr 2024; not indexed",
      "asOf": "2026-04-06",
      "reviewBy": "2027-04-06",
      "cadence": "tax-year",
      "triggers": [
        "april",
        "budget"
      ]
    },
    "hicbc.upperThreshold": {
      "value": 80000,
      "unit": "GBP nominal adjusted net income",
      "status": "FACT",
      "source": "gov.uk HICBC: fully withdrawn at £80,000",
      "asOf": "2026-04-06",
      "reviewBy": "2027-04-06",
      "cadence": "tax-year",
      "triggers": [
        "april",
        "budget"
      ]
    },
    "hicbc.taperPerStep": {
      "value": 0.01,
      "status": "FACT",
      "source": "gov.uk HICBC: 1% of the benefit per £200 of income over the lower threshold",
      "asOf": "2026-04-06",
      "reviewBy": "2027-04-06",
      "cadence": "tax-year",